title,job_description
project manager,betarchitect llc title project manager term full time duration long term location yerevan armenia job description betarchitect llc seeking project manager coordinate efforts local development team offshore development partner company incumbent energetic person ready new challenges good understanding agile software development methodologies functional specifications development job responsibilities responsible project planning execution throughout product lifecycle well gathering prioritizing product customer requirements communicate business decisions development progress across stakeholders projects work closely engineering design executive teams ensure smooth communication understanding companys overall strategy goals throughout team keep proactive communication collaboration external internal customers analyze information needs required qualifications higher education preferably technological background 35 years software project management experience technical background experience software development testing technical support domains knowledge common project management frameworks past experience agile methodologies plus ability motivate drive geographically distributed functional teams without formal authority excellent knowledge microsoft office microsoft project excellent knowledge written verbal russian language knowledge english language big advantage excellent communication teamwork skills meeting management skills ability work independently application procedures interested candidates asked submit cv english language hr indicating position title subject line email shortlisted candidates contacted please clearly mention application letter learned job opportunity career center mention url website wwwcareercenteram thanks opening date 20 january 2014 application deadline 19 february 2014 company betarchitect llc software development company aims build various software solutions targeted specific international market segments place free posting job careerrelated opportunities available organization go wwwcareercenteram website follow post announcement link
software developer,jaguar llc title software developer term part time full time start date time asap duration long term location yerevan armenia job description jaguar llc seeking specialist deep knowledge practical experience programming selected candidate participate company projects job responsibilities create innovative elegant design trade automation software responsible development software applications responsible optimization reengineering existing source codes required qualifications bachelors degree higher field related programming least 3 years work experience programming experience aspnet c experience creating multitier web applications expert knowledge net framework ability create develop maintain web projects experience working databases building administration networks good knowledge russian english languages level reading understanding documentation passion interesting tough tasks remuneration salary highly competitive depending previous experience skills application procedures interested candidates asked send detailed resume photo hr indicating position title subject line email please clearly mention application letter learned job opportunity career center mention url website wwwcareercenteram thanks opening date 30 january 2014 application deadline 28 february 2014 place free posting job careerrelated opportunities available organization go wwwcareercenteram website follow post announcement link
java developer,damaris llc title java developer location yerevan armenia job description damaris llc looking java developer participate damaris 3g developments job responsibilities participate companys web projects responsible development backend frontend required qualifications work experience relevant field experience team working knowledge oop principles knowledge mvc pattern ability work multiple tasks prioritize personal workload ability handle whole project lead small team knowledge jsp servlet j2ee jsf hibernate spring knowledge javascript html css knowledge struts html5 desired database proficiency sqlserver oracle desired application procedures interested candidates send last updated resume hr please mention subject line message position applying please clearly mention application letter learned job opportunity career center mention url website wwwcareercenteram thanks opening date 31 january 2014 application deadline 28 february 2014 company damaris llc local branch damaris france company providing software archiving package different companies europe place free posting job careerrelated opportunities available organization go wwwcareercenteram website follow post announcement link
project manager,global spc consulting company title project manager location yerevan armenia job description global spc consulting company seeking project manager provide highlevel project management assistance different projects funded donor organizations job responsibilities participate facilitate project implementation discussions consultations prepare project proposals terms references tor documents submission relevant donor organizations participate negotiations adhere contract scopes work plan manage project startups closeouts provide highquality deliverables reports review comment different projectrelated documents cooperate armenian public administration state bodies within framework different projects develop sectorspecific guidelines perform duties assigned senior project manager required qualifications degree international relations economics management fields related project management least 5 years experience foreignfunded projects fluency written spoken english language remuneration salary negotiable depending experience qualifications application procedures letter interest cv english language sent info applications received deadline incomplete applications considered candidates shortlisted interview contacted deadline interviews take place shortly afterwards please clearly mention application letter learned job opportunity career center mention url website wwwcareercenteram thanks opening date 04 february 2014 application deadline 03 march 2014 company global spc consulting company provides full legal business consulting customers place free posting job careerrelated opportunities available organization go wwwcareercenteram website follow post announcement link
project manager,cisp ngo title project manager start date time 01 march 2014 duration 1year contract renewable 2 years location yerevan armenia job description project manager responsible coordination implementation monitoring evaluation project activities manage coordinate project staff relations project partners stakeholders incumbent may make frequent trips lori region regions needed job responsibilities responsible project reporting formation periodic operative activity plans periodic project financial plan project advancement report internal monthly report official intermediate final financial narrative reports submit donor request project extension variation submit donor elaboration project visibility communication materials responsible elaboration terms reference experts consultants needed action coordinate monitor activities carried experts consultants study analyse project topicsrelated documentation armenian international elaborate reports researches field migration development policies field sustainable economic development organize training activities working groups conferences seminars study tours armenia abroad identify concrete mechanisms ensure active participation armenian diaspora representatives national international private sector representatives national international civil society organisations project activities implementation perform tasks responsibilities assigned country representative area manager based needs cisp plan projects armenia required qualifications knowledge english language knowledge foreign languages asset previous experience international cooperation projects asset knowledge migration development topics plus application procedures interested candidates send cvs tocisparmenia please clearly mention application letter learned job opportunity career center mention url website wwwcareercenteram thanks opening date 11 february 2014 application deadline 28 february 2014 company cisp international ngo place free posting job careerrelated opportunities available organization go wwwcareercenteram website follow post announcement link
software developer,betarchitect llc title software developer duration permanent location yerevan armenia job description betarchitect llc looking software developer knowledge net programming database development concepts job responsibilities participate software database design communicate effectively management team members develop applications according technical documentation provide technical support assistance requested required qualifications bs computer science related technical field least 2 years work experience software developer good knowledge oop good knowledge c aspnet mvc adonet web services knowledge x html css javascript xml knowledge wcfwpf big advantage knowledge ms sql server developing queries stored procedures fluency armenian language good knowledge russian english languages problemsolving skills familiarity software development process remuneration salary based qualifications experience application procedures interested candidates asked send resume cv english language directly hr please indicate software developer subject line email shortlisted candidates interviewed please clearly mention application letter learned job opportunity career center mention url website wwwcareercenteram thanks opening date 20 february 2014 application deadline 19 march 2014 company betarchitect llc software development company aims build various software solutions targeted specific international market segments place free posting job careerrelated opportunities available organization go wwwcareercenteram website follow post announcement link
java developer,slope technologies llc title java developer duration long term location yerevan armenia job description java developer work enhancement existing projects participate new projects job responsibilities investigate maintain written code base participate software design process develop software modules meeting specifications time performance constraints closely collaborate qa team aiming high quality software products required qualifications indepth knowledge object oriented paradigm design patterns relational databases clientserver model good knowledge written spoken english language work experience java sql jsp jstl javascript xml xsl html css ajax json knowledge spring framework jquery junit knowledge lbs location based services web mapping technologies strong advantage knowledge experience android ios mobile application development plus work experience bugzilla bug tracking system good team player open mindedness proactiveness selfdeterminedness remuneration salary competitive salary based experience skills progress stock options application procedures interested candidates send resumes english language info please clearly mention application letter learned job opportunity career center mention url website wwwcareercenteram thanks opening date 21 february 2014 application deadline 20 march 2014 company slope technologies llc startup software development company providing gis geographic information systems solutions web mobile customers place free posting job careerrelated opportunities available organization go wwwcareercenteram website follow post announcement link
web developer,systrotech llc title web developer location yerevan armenia job description systrotech llc looking qualified eligible candidates position web developer join crm development team learn new platform start contributing performing actual tasks earliest successful candidate undertake intensive training sage crm development tools one main domains company works required qualifications experience web development html css javascript jquery ajax plus experience php serverside language preferable database knowledge ms sql mysql servers basic knowledge classic asp net c oop experience web services plus experience cms plus basic knowledge designing tools adobe photoshop adobe illustrator corel draw ability adapt learn quickly good analytical skills ability work team good knowledge english language technical level remuneration salary comprehensive application procedures interested candidates asked download application form attached vacancy fill send email jobs shortlisted applicants filled standard systrotech application form considered contacted phone calls personal visits please please clearly mention application letter learned job opportunity career center mention url website wwwcareercenteram thanks opening date 24 february 2014 application deadline 23 march 2014 attachments following attachments announcement downloaded fromhttpwwwcareercenteramccdspannphpid19930 1 application form systrotech application formdoczip 12k place free posting job careerrelated opportunities available organization go wwwcareercenteram website follow post announcement link
web developer,avt mobile title web developer term full time start date time asap location yerevan armenia job description avt mobile seeking highly motivated hardworking web developer become part startup job responsibilities participate stages web backend development process read understand modify existing code develop maintain web backend applications accordance given specifications build web pages emails various marketing campaigns follow qa processes ensure consistency create code validates complies current web standards enforce web standards compliance ensure web pages content tested across multiple platforms browsers work collaboratively effectively team projects introduce implement innovative techniques technologies responsible selfmanage completion projects manage multiple tasks timelines thoroughly review work ensure quality required qualifications advanced knowledge php5 object oriented programming deep knowledge java script jquery html5 css3 knowledge mysql5 knowledge linux os ubuntu centos etc plus experience version control systems git svn plus knowledge zend framework bootstrap mvc frameworks plus fast learner responsible personality good problemsolving skills ability work independently flexibility learning new technologies remuneration salary highly competitive application procedures meet listed requirements qualifications asked send application letter cv tohr please clearly mention application letter learned job opportunity career center mention url website wwwcareercenteram thanks opening date 05 march 2014 application deadline 04 april 2014 company avt mobile project avento llc software development company place free posting job careerrelated opportunities available organization go wwwcareercenteram website follow post announcement link
software developer,betarchitect llc title software developer duration permanent location yerevan armenia job description betarchitect llc looking software developer knowledge net programming database development concepts job responsibilities participate software database design communicate effectively management team members develop applications according technical documentation provide technical support assistance requested required qualifications bs computer science related technical field least 2 years work experience software developer good knowledge oop good knowledge c aspnet mvc adonet web services knowledge x html css javascript xml knowledge wcfwpf big advantage knowledge ms sql server developing queries stored procedures fluency armenian language good knowledge russian english languages problemsolving skills familiarity software development process remuneration salary based qualifications experience application procedures interested candidates asked send resume cv english language directly hr please indicate software developer subject line email shortlisted candidates interviewed please clearly mention application letter learned job opportunity career center mention url website wwwcareercenteram thanks opening date 07 march 2014 application deadline 06 april 2014 company betarchitect llc software development company aims build various software solutions targeted specific international market segments place free posting job careerrelated opportunities available organization go wwwcareercenteram website follow post announcement link
java developer,be2 ltd title java developer term full time start date time asap duration long term location yerevan armenia job description na job responsibilities estimate effort design technical solutions user stories tasks design solution architecture module design critical parts user story task teams commit deliver software meets development standards code quality architectural guidelines unit tests testing frameworks required qualifications experience creating scalable j2ee applications considering quality redundancy performance availability good knowledge spring mongodb mysql tomcat rest ajax javascript knowledge groovy grails angularjs android desirable high level quality assurance expertise working industry standards tools junit selenium jmeter etc working experience maven git preferable experience agile methodology scrum good knowledge english language companys working language remuneration salary attractive depends candidate excellent employee benefit package application procedures interested candidates email cvs jobsyerevan referring job title please clearly mention application letter learned job opportunity career center mention url website wwwcareercenteram thanks opening date 12 march 2014 application deadline 11 april 2014 company be2 online matchmaking company offers service 37 countries 28 million members information companys product activities please visit wwwbe2com wwwinsparxcom place free posting job careerrelated opportunities available organization go wwwcareercenteram website follow post announcement link
java developer,monitis gfi cjsc title java developer start date time asap duration long term location yerevan armenia job description monitis gfi cjsc looking java developer job responsibilities participate application design provide necessary technical design documentation communicate effectively local management external team members develop features according technical specifications required qualifications university degree appropriate field studies least 2 years practical experience java development knowledge databases mysql mssql oracle cassandra hbase good knowledge oop principles knowledge nodejs advantage experience using eclipse ide preferable experience working linux environment ubuntu suse good analytical skills ability work team good knowledge english language communication technical levels remuneration salary highly competitive depending previous experience skills benefit package medical insurance training programs sport activities application procedures interested qualified candidates welcome send cvs hr please indicate position title subject field message shortlisted candidates interviewed please clearly mention application letter learned job opportunity career center mention url website wwwcareercenteram thanks opening date 20 march 2014 application deadline 19 april 2014 company monitis teamviewer company global monitoring provider information company please visithttpwwwmonitiscomaboutus place free posting job careerrelated opportunities available organization go wwwcareercenteram website follow post announcement link
web developer,monitis gfi cjsc title web developer term full time start date time asap duration long term location yerevan armenia job description monitis gfi cjsc seeking web developer job responsibilities implement web applications take responsibility make changes live environment required qualifications university degree appropriate field studies least 2 years work experience appropriate field ability create professional web pages using html html5 css css3 technologies ability work big data develop modules meet high performance thresholds knowledge jquery cross browser experience good knowledge javascript interest design ability modify things add things given design detailoriented personality problemsolving analytical skills ability clearly communicate share solutions fellow team members ability respect deadlines good knowledge english language remuneration salary highly competitive depending previous experience skills benefit package medical insurance training programs sport activities application procedures interested qualified candidates welcome send cvs hr please indicate position title subject field message shortlisted candidates interviewed please clearly mention application letter learned job opportunity career center mention url website wwwcareercenteram thanks opening date 21 march 2014 application deadline 20 april 2014 company monitis gfi cjsc teamviewer company global monitoring provider information company please visithttpwwwmonitiscomaboutus place free posting job careerrelated opportunities available organization go wwwcareercenteram website follow post announcement link
web developer,joomag llc title web developer announcement code jam712 term full time start date time asap duration long term location yerevan armenia job description joomag llc seeking motivated highlyskilled web developer candidate expert javascript css php thrive quality passionate job responsibilities lead development efforts largescale webbased projects ensuring robust lasting solutions implemented work closely web mobile designers translate designs websites apps html emails interactive experiences test debug build code works across multiple browsers digital platforms maintain existing javascript libraries making sure support engineering creative needs companys website make innovations build things people blog required qualifications strong knowledge modern web standards html5 css3 javascript jquery experience ability write plugins experience php objectoriented design mvc architecture frameworks development experience mysql experience responsive design jquery mobile approaches used designed mobile users experience subversion git source control tools knowledge typography whitespace details occur intersection design code ability work independently part team basic knowledge adobe photoshop knowledge design patterns good knowledge english language remuneration salary highly competitive depending previous experience skills application procedures interested qualified candidates invited send cvs resumes hrarmenia please indicate announcement code subject field message please clearly mention application letter learned job opportunity career center mention url website wwwcareercenteram thanks opening date 27 march 2014 application deadline 26 april 2014 company joomag llc digital publishing company place free posting job careerrelated opportunities available organization go wwwcareercenteram website follow post announcement link
java developer,webb fontaine holding llc title java developer term full time start date time immediately location yerevan armenia job description webb fontaine holding llc seeking java developer responsible development java applications required qualifications bachelors degree computer science masters degree plus least 1 year experience java development working knowledge experience struts 2 spring grails groovy jsf 2 seam jboss web services fluency english language written spoken ability travel abroad required remuneration salary competitive application procedures interested candidates send cvs motivation letters english language office qualified candidates contacted interview please clearly mention application letter learned job opportunity career center mention url website wwwcareercenteram thanks opening date 31 march 2014 application deadline 30 april 2014 company webb fontaine holding sa company based switzerland offers expertise services solutions field egovernment new technologies wwwwebbfontainecom place free posting job careerrelated opportunities available organization go wwwcareercenteram website follow post announcement link
