title,job_description
java developer,boomerang software llc title java developer term full time start date time asap duration permanent location yerevan armenia job description boomerang software llc looking java developers engaged different long term projects job responsibilities develop web application java ability develop high quality clean code apply proper language constructions use quality algorithms required qualifications advanced knowledge oop ood least 2 years work experience software developer java experience web development web frameworks struts jspservlet experience development clientserver applications client server web application components knowledge web services axis soap plus database knowledge mysql oracle databases knowledge sql language knowledge html css javascript xml persistence layer knowledge ojb hibernate plus excellent knowledge german remuneration salary high application procedures interested please email cv tooffice short listed candidates invited interview please clearly mention application letter learned job opportunity career center mention url website wwwcareercenteram thanks opening date 11 february 2008 application deadline 10 march 2008 company boomerang software software company develops software products american european markets provides services partners world place free posting job careerrelated opportunities available organization go wwwcareercenteram website follow post announcement link
web developer,boomerang software llc title web developer term full time open eligibility criteria qualified candidates start date time 15 february 2008 duration permanent location yerevan armenia job description boomerang software llc looking web developers engaged different long term projects job responsibilities develop web application php required qualifications least 2 years work experience software developer php experience web development well knowledge xhtml css javascript database knowledge mysql aspnet c preferred well oral written knowledge english language remuneration salary high application procedures interested please email cv tooffice short listed candidates invited interview please clearly mention application letter learned job opportunity career center mention url website wwwcareercenteram thanks opening date 15 february 2008 application deadline 14 march 2008 company boomerang software software company develops software products american european markets provides services partners world place free posting job careerrelated opportunities available organization go wwwcareercenteram website follow post announcement link
project manager,damaris llc title project manager duration long term location yerevan armenia job description damaris llc seeking project manager manage companys projects job responsibilities create manage update project related documentation schedule conduct document project related meetings meet established project deadlines assign tasks manage proper implementation keep project track manage evaluate developers work contribute improvement development process test projects write test cases successfully communicate external management development staff follow overall framework company make valuable suggestions improvement required qualifications least 3 years experience pm position knowledge pm techniques software development methodologies knowledge software development life cycle experience usage pm tools strong organizational communication skills ability work pressure multitask environment excellent knowledge english language knowledge french plus remuneration salary competitive application procedures interested candidates email resumes info please clearly mention application letter learned job opportunity career center mention url website wwwcareercenteram thanks opening date 20 february 2008 application deadline 17 march 2008 company damaris local branch damaris france company providing software archiving package different companies europe place free posting job careerrelated opportunities available organization go wwwcareercenteram website follow post announcement link
database administrator,imex group co ltd title database administrator term full time open eligibility criteria highly qualified personx deep knowledge practical experience ms sql server 2000 2005 administrating duration long term location yerevan armenia job description na job responsibilities establish needs users plan dataflows new revised database map conceptual design planned database outline consider back end organisation data front end accessibility end users refine logical design translated specific data model refine physical design meet system storage requirements test new systems maintain data standards including adherence data protection act write database documentation including data standards procedures definitions data dictionary metadata controll access permissions privileges train users meet users access requirements resolve problems ensure storage archiving backup recovery procedures functioning correctly responsible capacity planning work closely project managers database programmers web developers provide technical support outdated legacy systems communicate regularly technical applications operational staff ensure database integrity security commission install new applications use monitoring troubleshooting utilities effectively diagnose problems required qualifications university degree technical sciences least 1 year relevant work experience network administration expertise system administration configuration troubleshooting performance tuning preventative maintenance security procedures good knowledge experience principles ad active directory possession excellent analytical skills diagnose resolve server router remuneration salary based experience highly competitive application procedures applications accepted every day besides saturday sunday 10001600 tbilisyan highway 25 yerevan tel 288641 please mention application position title applying please clearly mention application letter learned job opportunity career center mention url website wwwcareercenteram thanks opening date 13 march 2008 application deadline 12 april 2008 company imex group co ltd involved import sale sanitary ware ceramics place free posting job careerrelated opportunities available organization go wwwcareercenteram website follow post announcement link
web developer,imex group co ltd title web developer term full time open eligibility criteria highly qualified experienced web programmers duration long term location yerevan armenia job description na job responsibilities develop web application following given design standards software architecture write read xml using known parsers assure full conformance source codes provided coding standards read understand modify existing code work part software development team communicate management team members effectively required qualifications university degree technical sciences least 1 years work experience software development good knowledge php asp java good knowledge experience principles oop good knowledge flesh technologies english language skills remuneration salary based experience highly competitive application procedures applications accepted every day besides saturday sunday 10001600 tbilisyan highway 25 yerevan tel 288641 please mention application position title applying please clearly mention application letter learned job opportunity career center mention url website wwwcareercenteram thanks opening date 13 march 2008 application deadline 12 april 2008 company imex group co ltd involved import sale sanitary ware ceramics place free posting job careerrelated opportunities available organization go wwwcareercenteram website follow post announcement link
java developer,energize global services cjsc title java developer term full time open eligibility criteria qualified candidates start date time asap duration permanent location yerevan armenia job description energize global services cjsc looking java developers engaged different long term projects job responsibilities develop web application java ability develop high quality clean code apply proper language constructions use quality algorithms required qualifications advanced knowledge oop ood least 2 years work experience software developer java experience web development web frameworks struts jspservlet experience development clientserver applications client server web application components knowledge web services axis soap plus database knowledge mysql oracle databases knowledge sql language knowledge html css javascript xml persistence layer knowledge ojb hibernate plus excellent knowledge german language remuneration salary high application procedures interested please email cv tooffice short listed candidates invited interview please clearly mention application letter learned job opportunity career center mention url website wwwcareercenteram thanks opening date 14 march 2008 application deadline 01 april 2008 company energize global services cjsc software development company specializes offshore development provides services partners world place free posting job careerrelated opportunities available organization go wwwcareercenteram website follow post announcement link
java developer,epam systems inc title java developer announcement code epm06 term full time intended audience professionals start date time asap duration permanent location yerevan armenia job description epam systems actively looking java developers complex longterm projects position entails working sun ibm products portal solutions latest java technologies job responsibilities develop software according requirements participate tasks estimation complete work according deadlines take part mentoring developers professional skills required qualifications good knowledge oop ood experience projects java developer j2ee jsp servlets jdbc ejb jms struts 1 year experience development multilayered clientserver applications client server components experience oracle ms sql databases good understanding design patterns basic knowledge uml ability develop quality code apply proper language constructions use quality algorithms punctuality accuracy work ability work efficiently without supervision willingness increase competencies professionalism basic knowledge english language fluent knowledge russian language desired qualifications ability responsibly complete assigned tasks according deadlines good productive capacity energetic personality ability express thoughts clearly ability work one task time without supervision remuneration salary high application procedures please email cvs yerevanhr refer announcement code subject line please clearly mention application letter learned job opportunity career center mention url website wwwcareercenteram thanks opening date 19 march 2008 application deadline 18 april 2008 company according brownwilson group survey epam systems 1 software engineering outsourcing services provider central eastern europe founded 1993 epam maintains north american headquarters lawrenceville nj currently 3500 highly qualified professionals working epam systems epam software development centers located russia hungary belarus ukraine armenia company continues growth development mission delivering excellence software engineering benefit clients httpwwwtheblackbookofoutsourcingcomtop10itooffshoreeasterncentraleuropehtml additional notes 2006 epam systems merged vdi presence development expertise armenia along global workforce combined company 22 branches 8 countries 3500 employees epam distinguished technology expertise proven customers sap reuters microsoft bea systems emc many others company combined expertise horizontal solutions crm erp dms cms scm eai bi place free posting job careerrelated opportunities available organization go wwwcareercenteram website follow post announcement link
network administrator,synergy international systems incarmenia title network administrator start date time immediate duration long term location yerevan armenia job description responsibilities network administrator focused installation configuration maintenance companys local area network lan overseeing ensure functions smoothly network administrator may responsible customizing network companys needs connecting necessary software hardware network job responsibilities perform backups servers workstations add delete new network users work active directory ensure virus protection software uptodate cleaning viruses infect staff computers servers train assist staff using hardware software efficiently troubleshoot routine problems responsible software installation maintenance upgrading responsible hardware installation maintenance upgrading administrate maintain routine network responsible network documentation supervise database set configure maintain lan maintain external internal connectivity evaluate changes current future network requirements meet companys needs ensure security information stored grant access operating rights relevant people install maintain troubleshoot computers mark recommendations installation new hardware software install maintain emergency systems back main network server duties may assigned required qualifications masters degree strong background math systems science computer science engineering 2 years experience similar work high energy positive personality fluency english language ability take criticism knowledge experience network software hardware installation knowledge work experience microsoft windows operating system ability implement active directory dns dhcp vpn rras etc knowledge nixbased operating systems ability implement configure firewall ssh squid bind etc knowledge security administration ability implement pki ssltls l2tp ipsec knowledge dbms administration ms sql mysql knowledge computing network hardware peripheral equipment ability install maintain lans supporting various networking technologies work experience switches firewalls routers ability manage time effectively work pressure multitask environment meeting deadlines ability identify resolve computer system malfunctions operational problems display professionalism welldeveloped interpersonal skills ability work effectively team environment well comfortable managing projects limited supervision excellent analytical problemsolving skills attention detail ability analyze complex problems interpret operational needs develop integrated creative solutions self motivated personality technically proficient able grasp new concepts systems applications quickly excellent oral written communications skills demonstrated ability collaborate effectively developers nondevelopers ability communicate technical information nontechnical personnel application procedures candidates meet qualifications shortlisted interviewed selected candidates notified interview dates directly interested please send resume cover letter listing qualifications position related experience indicating contact details phone fax andor email address reached ms hasmik hovsepyan human resource manager email mail phone 374 10 54 40 24 56 76 81 ext 14 please clearly mention application letter learned job opportunity career center mention url website wwwcareercenteram thanks opening date 25th march 2008 application deadline 07 april 2008 500 pm company synergy international systems inc us software company operating armenia yerevan subsidiary specializing development integrated web portal web databases web services systems place free posting job careerrelated opportunities available organization go wwwcareercenteram website follow post announcement link
java developer,virtual solution global services llc title java developer duration long term location yerevan armenia job description virtual solution global services llc seeking motivated java developer web based applications development job responsibilities participate application design provide necessary technical design documentation communicate effectively local management external team members develop applications according technical documentation develop test cases install configure necessary environment developed applications provide support web servers databases applications maintenance required qualifications least 3 years work experience software developer excellent knowledge java oop excellent knowledge web development web frameworks struts jspservlet java server faces persistence layer ojb ibatis hibernate optional java technologies spring framework databases base knowledge mysql oracle databases ability work without graphical user interface highly appreciated excellent knowledge sql language database modeling skills good knowledge xhtml css javascript xml optional technologies velocity jasper reports facelets build environment ant maven tomcat 5 apache2 webserver os linux choose distro company uses ubuntu os windows accepted linux required high skills linux operating system system administration writing shell scripts etc ability work project development team ability lead small developer team would plus problem solving skills good communication skills good english language skills remuneration salary competitive application procedures interested candidates email resumes vbghdoyan please clearly mention application letter learned job opportunity career center mention url website wwwcareercenteram thanks opening date 28 march 2008 application deadline 27 april 2008 company virtual solution global services llc branch virtual solution consulting gmbh german company expertise web applications development based java open source technologies additional information company please visit website wwwvirtualsolutionde place free posting job careerrelated opportunities available organization go wwwcareercenteram website follow post announcement link
software developer,united factors group llc title software developer location yerevan armenia job description looking highly qualified person deep knowledge practical experience clientserver web programming job responsibilities develop database applications accordance given specifications develop web applications accordance given specifications assure full conformance source codes provided coding standards read understand modify existing code work part software development team assist development accompanying technical documentation requested provide technical support assistance requested required qualifications higher education relevant field good knowledge net framework vbnet c adonet good knowledge oracle ms sql server good knowledge pl sql plus good knowledge crystal reports plus work experience client server applications experience web technologies plus good knowledge russian english languages good communication skills remuneration salary based experience capabilities candidate application procedures apply please email cv english toinfo please clearly indicate software developer subject line email shortlisted candidates contacted please clearly mention application letter learned job opportunity career center mention url website wwwcareercenteram thanks opening date 28 march 2008 application deadline 27 april 2008 company united factors group llc specialized company developing providing business solutions factoring invoice discounting industries fore information company please visit website wwwufgroupam place free posting job careerrelated opportunities available organization go wwwcareercenteram website follow post announcement link
software developer,synopsys armenia amsg title software developer term full time start date time asap duration long term location yerevan armenia job description synopsys armenia cjsc seeking software developer engaged software design development using cc required qualifications bs csee least 1 year work experience software development familiarity programming software development cycle ability design algorithms data structures excellent knowledge cc together stl library good knowledge qt tcl knowledge plus excellent knowledge linux ability work team remuneration salary highly competitive negotiable bonus program comprehensive medical insurance package english language trainings application procedures please email detailed cv todianan cc vbel hhovikgaregin indicating position title subject line email shortlisted candidates contacted please clearly mention application letter learned job opportunity career center mention url website wwwcareercenteram thanks opening date 02 april 2008 application deadline 30 april 2008 company synopsys inc provider electronic design automation eda software services synopsys armenia cjsc established october 2004 synopsys international ltd place free posting job careerrelated opportunities available organization go wwwcareercenteram website follow post announcement link
software developer,synopsys armenia seg title software developer term full time start date time asap duration long term location yerevan armenia job description na job responsibilities responsible designing developing troubleshooting debugging software programs physical design database viewer editor lithography simulation analysis involved phases software development including project planning problem identification design specifications development scheduling implementation testing work complex problems analysis situations data requires indepth evaluation various factors exercise judgment within broadly defined practices policies selecting methods techniques evaluation criteria obtaining results develop state art solutions technical contributions lead significant product differentiation design implement sophisticated algorithms solve complex problems required qualifications bs relevant field 1 years experience development proficiency c knowledge algorithms data structures proficiency qt preferably qt4 proficiency ms visualstudio knowledge ic layout good knowledge english language desired skills development experience linux using gcc experience threading locking data structures asynchronous state machines experience highly interactive guis xwindows development layout editors cadence virtuoso remuneration salary competitive negotiable bonus program comprehensive medical insurance package english language trainings application procedures please submit detailed cv todianan cc hdole vahagnk indicating position subject line email shortlisted candidates contacted please clearly mention application letter learned job opportunity career center mention url website wwwcareercenteram thanks opening date 02 april 2008 application deadline 30 april 2008 company synopsys inc provider electronic design automation eda software services synopsys armenia cjsc established october 2004 synopsys international ltd place free posting job careerrelated opportunities available organization go wwwcareercenteram website follow post announcement link
java developer,epam systems inc title java developer announcement code epm06 term full time intended audience professionals start date time asap duration permanent location yerevan armenia job description epam systems actively looking java developers complex longterm projects position entails working sun ibm products portal solutions latest java technologies job responsibilities develop software according requirements participate tasks estimation complete work according deadlines take part mentoring developers professional skills required qualifications good knowledge oop ood experience projects java developer j2ee jsp servlets jdbc ejb jms struts 1 year experience development multilayered clientserver applications client server components experience oracle ms sql databases good understanding design patterns basic knowledge uml ability develop quality code apply proper language constructions use quality algorithms punctuality accuracy work ability work efficiently without supervision willingness increase competencies professionalism basic knowledge english language fluent knowledge russian language desired qualifications ability responsibly complete assigned tasks according deadlines good productive capacity energetic personality ability express thoughts clearly ability work tasks without supervision remuneration salary high application procedures please email cvs yerevanhr refer announcement code subject line please clearly mention application letter learned job opportunity career center mention url website wwwcareercenteram thanks opening date 18 april 2008 application deadline 17 may 2008 company according brownwilson group survey epam systems 1 software engineering outsourcing services provider central eastern europe founded 1993 epam maintains north american headquarters lawrenceville nj currently 3500 highly qualified professionals working epam systems epam software development centers located russia hungary belarus ukraine armenia company continues growth development mission delivering excellence software engineering benefit clients httpwwwtheblackbookofoutsourcingcomtop10itooffshoreeasterncentraleuropehtml additional notes 2006 epam systems merged vdi presence development expertise armenia along global workforce combined company 22 branches 8 countries 3500 employees epam distinguished technology expertise proven customers sap reuters microsoft bea systems emc many others company combined expertise horizontal solutions crm erp dms cms scm eai bi place free posting job careerrelated opportunities available organization go wwwcareercenteram website follow post announcement link
