title,job_description
software developer,yerevan brandy company job title software developer position location yerevan armenia job responsibilities rendering technical assistance database management systems realization sql servers maintenance activities backup replication participation designing software development projects required qualifications university degree economical background plus excellent knowledge windows 2000 server networking tcp ip technologies ms sql 2000 server visual basic 6 least 2 years experience database software development good knowledge english remuneration commensurate norms accepted company application procedures successful candidates submit cv 2 relevant recommendation letters previous employers copy ies diploma relevant certificates available 1 color photo 3x4 either 2 isakov avenue 375082 yerevan send following fax 587 713 email toarminebibilyan human resources department armine bibilyan please clearly mention application letter learned job opportunity career center mention url website wwwcareercenteram thanks application deadline 20 january 2004 1800 place free posting job career related opportunities organization careercenteram website email us atmailbox
network administrator,netcall communications job title network administrator position location yerevan armenia job responsibilities network monitoring administration database administration ms sql 2000 required qualifications excellent knowledge windows 2000 server linux platform networking tcp ip technologies ms sql 2000 server least 2 years experience proper field good knowledge english application procedures successful candidates submit cv 12 relevant recommendation letters previous employers tojob please clearly mention application letter learned job opportunity career center mention url website wwwcareercenteram thanks application deadline 28 february 2004 1800 place free posting job career related opportunities organization careercenteram website email us atmailbox
software developer,synergy international systems incarmenia job title software developer position location yerevan armenia job description synergy international systems incarmenia seeks fill longterm position software developer responsibilities position focused core software development tasks synergy international systems inc synergys main focus developing integrated stateoftheart web database web portal systems business intelligence knowledge management egovernment solutions position filled software developer proven history producing quality software product commercial setting experience dynamic workplace solid software developing practice required ideally position filled candidate experience aspects software development process including design implementation testing delivery job responsibilities specific tasks key responsibilities include limited following translate design requirements specifications robust implementations design prototype develop manage technical aspects software perform implementations timely fashion perform quality assurance tasks testing software products required qualifications degree computer science information technology related discipline bachelors degree relevant field required masters degree preferred least 3 years successful experience software development extensive development experience current industry technologies including java sql etc related tools working experience design complex database systems stored procedures experience j2ee development jsp servlets knowledge one programming languages cvisual c vb knowledge htmlxml aspphp additional characteristics ability work pressure multitask environment ability work team selfdirected highly motivated excellent analytical problemsolving skills attention detail excellent interpersonal organizational skills fluency english application procedures interested please send resume cover letter listing qualifications software development related experience indicating contact details phone fax andor email address reached ms anahit sargsyan office manager mail mailarm phone 374 1 56 76 81 candidates meet qualifications interviewed required take test selected candidates notified interview dates directly please clearly mention application letter learned job opportunity career center mention url website wwwcareercenteram thanks application deadline 15 march 2004 5 pm company synergy international systems inc us software company operating armenia yerevan subsidiary specializing development integrated information management systems place free posting job career related opportunities organization careercenteram website email us atmailbox
project manager,united nations development programme job title project manager position location yerevan armenia job description undp ministry health seek professionals project hivaids uniformed services job responsibilities daily management project activities leading supervising monitoring project staff expert groups conducting kap knowledge attitude practices surveys among 600 uniformed personnel undertaking situation response analysis developing specific strategic plan hivaids interventions uniformed services liaise relevant ministries programs international local counterparts especially hivaids focal points three cooperating ministries ministry justice ministry defence police reporting ministry health undp outputs project required qualifications advanced university degree public health related field least 3 years working experience international organizations good knowledge institutional framework armenias hivaids prevention system good knowledge unaids policies strategies familiarity global regional initiatives including armenia project funded global fund fight aids tb malaria strong analytical skills ability make recommendations present proposals improvement change project activities proficiency usage computers office software package ms word excel internet intranet good team work spirit proficiency armenian russian good knowledge english asset application procedures candidates submit letter motivation english position project coordinator assistant full cvor completed un p11 form obtained un security desk accompanied recent identity photograph copies diplomas applications also submitted httpocundpam site vacancies announcements late incomplete applications considered please clearly mention application letter learned job opportunity career center mention url website wwwcareercenteram thanks application deadline 29 february 2004 1700 place free posting job career related opportunities organization careercenteram website email us atmailbox
network administrator,cit ltd title network administrator term full time location yerevan armenia job description cit looking qualified network administrator deal lan wans required qualifications good knowledge win 2000 server win 2003 server exchange mail server unix linux ad dc dns lan wan work experience less 3 years application procedures qualified candidates send resume rosak please clearly mention application letter learned job opportunity career center mention url website wwwcareercenteram thanks application deadline 15 may 2004 place free posting job careerrelated opportunities organization careercenteram website email us atmailbox
project manager,foundation internews georgia title project manager location tbilisi georgia job description foundation internews georgia seeking qualified candidate full time position project manager job responsibilities manage enhance implementation projects prepare monthly andor quarterly programmatic reports agreement funders upon requirements identify develop news projectprogram proposals donorclient funded activities working independently solicit funds donors contribute fundraising prepare general reports covering projects activities implemented internews develop impact assessment develop regular statistic programmatic analysis internews activities undertake general business correspondence represent organization interactions international community state bodies nongovernmental organizations coordinate implementation ongoing projects absence executive director required qualifications university degree public administration political science law education social science development related studies least 3 years work experience managerial level international nongovernmental organization experience donorfunded activitiesprojects ability work independently pressure experience donor funded project design management strong skills demonstrated experience project proposal development fundraising strong skills demonstrated experience programmatic reporting professional experience sectors governance civil society advocacy rights media development human rights social development strong analytical communication organisational skills strong interpersonal skills ability commitment work individually part team flexibility ability cope unexpected handle prioritize full workload skills confidence represent internews georgia levels fluency georgian english speaking writing good knowledge russian computer proficiency ms applications windows word excel power point ability travel regions application procedures please submit resume english short cover letter explaining would want job hard copy internews georgia 1422 paolo iashvili st tbilisi 0105 attention tamuna kakulia email tamriko phone calls please shortlisted applicants contacted interview please clearly mention application letter learned job opportunity career center mention url website wwwcareercenteram thanks application deadline 15 june 2004 6 pm place free posting job careerrelated opportunities organization careercenteram website email us atmailbox
software developer,synergy international systems inc armenia title software developer duration longterm location yerevan armenia job description responsibilities position focused core software development tasks synergy international systems inc synergys main focus developing integrated web database web portal systems position filled software developer proven history producing quality software product commercial setting experience dynamic workplace solid software developing practice required ideally position filled candidate experience aspects software development process including design implementation testing delivery job responsibilities specific tasks key responsibilities include limited translate design requirements specifications robust implementations design prototype develop manage technical aspects software perform implementations timely fashion perform quality assurance tasks testing software products required qualifications degree computer science information technology related discipline bachelors degree relevant field required masters degree preferred least 3 years successful experience software development extensive development experience current industry technologies including java sql etc related tools working experience design complex database systems stored procedures experience j2ee development jspservlets knowledge one programming languages cvisual c vb knowledge htmlxml aspphp additional characteristics ability work pressure multitask environment ability work team selfdirected highly motivated excellent analytical problemsolving skills attention detail excellent interpersonal organizational skills fluency english application procedures interested please send resume cover letter listing qualifications software development related experience indicating contact details phone fax andor email address reached contact person stipulated contact info ms anahit sargsyan office manager synergy international systems incarmenia 4 6 korioun st yerevan 375009 ra tel 374 1 56 76 81 email mailarm mail candidates meet qualifications interviewed required take test selected candidates notified interview dates directly please clearly mention application letter learned job opportunity career center mention url website wwwcareercenteram thanks application deadline 10 june 2004 500 pm company synergy international systems incurl wwwsynisyscom us software company operating armenia yerevan subsidiary specializing development integrated web database systems place free posting job careerrelated opportunities organization careercenteram website email us atmailbox
network administrator,fordilling holding co title network administrator announcement code 089494 open eligibility criteria citizens armenia 2230 yo duration longterm 1 month initial probation period location yerevan armenia job description na job responsibilities setup followon pc park setting mini office automatic phone station panasonic application lan usage scs technologies consulting starting users pc required qualifications complete higher education excellent knowledge skills windows xp lan wan scs network technologies rich experience diagnostics methods ability learn fast apply gained knowledge knowledge applyed programming ms office 2000 mail client thebat icq application procedures send cv cover letter tofordilling please clearly mention application letter learned job opportunity career center mention url website wwwcareercenteram thanks opening date 12 june 2004 application deadline 16 june 2004 company armenian branch russian company fordilling holding company providing services private investors international exchange bond market place free posting job careerrelated opportunities available organization go wwwcareercenteram website follow post announcement link
project manager,lycos europe title project manager location yerevan armenia job description project manager mainly project management administration position person follows progress teams various projects planning together architect role requires problemsolving attitude job responsibilities plan follow projects report progress risks deviations plan coach team communication product group international communication work together system architecture ensure quality project required qualifications least 5 years experience project management 5person larger teams least 2year experience working internet related projects successful track records experience working different software development methods experience project management administration skills 3 years knowledge development methodologies xprogramming rup etc good management skills excellent communication skills excellent english skills application procedures send cv info please clearly mention application letter learned job opportunity career center mention url website wwwcareercenteram thanks application deadline 15 july 2004 company lycos armenia currently employs 71 employees since growing demand european development offices actually engaging new staff plan employ 100 employees end year additionally lycos armenia building operations department plan 20 employees end year many lycos products partly fully programmed armenia located 9 alek manookian str place free posting job careerrelated opportunities available organization go wwwcareercenteram website follow post announcement link
software developer,xalt llc title software developer location yerevan armenia job description xalt llc seeking motivated experienced software developer web environment evaluate solutions create detailed system requirement specifications well system design functional specifications software developer support project management team innovative ideas job responsibilities writing high quality code based implementation specification effective programming unixlinux environment participating web applications design development updating existing websites scripting web programming required qualifications successful candidate required strong knowledge php mysql html xml knowledge data structures algorithms database concepts required cc perl programming languages knowledge desirable least two years experience relevant field good knowledge english team oriented organized initiative willing learn new skills application procedures interested software developers position please email cover letter cv toinfo please clearly mention application letter learned job opportunity career center mention url website wwwcareercenteram thanks application deadline july 20 2004 place free posting job careerrelated opportunities available organization go wwwcareercenteram website follow post announcement link
software developer,zenteq title software developer intended audience engineers scientists location yerevan armenia job description position assumes participation full development deployment cycle software products solutions developed company collaboration renderx inc job responsibilities expect successful candidate able design develop software products create programs heterogeneous environments ms windows unix communicating means network protocols author maintain internal enduser documentation required qualifications applicants exposure previous experience programming languages c perl ruby python java c data processing technologies xml relational databases particularly interested candidates experience oracle dbms application programming j2ee architecture applications development net frameworkbased technologies remuneration salary competitive application procedures send cover letter curriculum vitae tohumanresources plain text pdf please phone calls faxed inquiries please clearly mention application letter learned job opportunity career center mention url website wwwcareercenteram thanks opening date 30 july 2004 application deadline 15 september 2004 company zenteq software company affiliated renderx inc place free posting job careerrelated opportunities available organization go wwwcareercenteram website follow post announcement link
web developer,project harmony armenia title web developer start date time september 2004 location yerevan armenia job description project harmony innovate nonprofit organization builds strong communities fostering civic leadership harnessing internet technology facilitating crosscultural experiential learning currently accepting applications positions within armenia school connectivity programs high profile secondary school technology education programs us department state bureau educational cultural affairs zang armenian legal socialization project unique project brings together educators law enforcement officials create lessons legal socialization piloted secondary schools throughout armenia job responsibilities web sites creation programming organization maintenance phpmysql data base creation programming maintenance schools web sites administration consultations interactive online space creation administration maintenance web training consultation required qualifications must bachelors degree higher must experience xml xsl html dhtml photoshop corelflash javascript css sql phpmy sql perl macromedia dreamweaver must experience apache 13 higher must experience unixlinux system administration ability troubleshoot problems research service enhancements must excellent communications problem solving trouble shooting must self starter takes initiative highly motivated quick learn new technologies ability read technical documentation english ability write administrative reports english application procedures applications accepted rolling bases please email resume cover letter mourad mouradian pharmenia technical manager mourad august 8 2004 subject line message clearly write application web developer additional information please call project harmony armenian office 01 2606868788 22744373 please clearly mention application letter learned job opportunity career center mention url website wwwcareercenteram thanks application deadline 15 august 2004 armenia connectivity 2000 successfully implemented two years technology education programming armenia set expand activities course next two years armenia school connectivity program ascp also program us department state bureau educational cultural affairs twoyear program expansion provide resources internet access training network 350 participating schools across 11 regions armenia ascp provide students educators community members opportunities access share information engage online collaborative projects develop technical skills marketable digital world program increase schoolcommunity interaction usarmenian partnerships school community level civic engagement local national international level place free posting job careerrelated opportunities available organization go wwwcareercenteram website follow post announcement link
project manager,international society fair elections democracy isfed title project manager term fulltime location tbilisi georgia job description international society fair elections democracy isfed announces vacancy fulltime position project manager job responsibilities lead coordinate organizations relations mass media ngos state institutions general public organize meetings briefings press conferences draft press releases edit prepare materials organizations website create promotion educational materials train organization members pr issues responsible executive director pr relations required qualifications university degree relevant fields journalism political sciences public relations fluency spoken written georgian english russian 3 years working experience field strong presentation communication interpersonal skills strong analytical skills ability develop innovative approaches ability provide trainings pr issues knowledge ms office applications political awareness good connections mass media advantage application procedures interested candidates send cvs toinfo email fax 995 32 989824 please clearly mention application letter learned job opportunity career center mention url website wwwcareercenteram thanks application deadline 11 september 2004 6 pm place free posting job careerrelated opportunities available organization go wwwcareercenteram website follow post announcement link
web developer,sada systems title web developer term fulltime location yerevan armenia job description sada systems armenia looking specialists web developer work dynamic high profile project deliver latest microsoft technology aspnet adonet c sql server 2000 required qualifications proven knowledge minimum 1 year experience net c application procedures send resume techjobs please clearly mention application letter learned job opportunity career center mention url website wwwcareercenteram thanks application deadline 20 september 2004 place free posting job careerrelated opportunities available organization go wwwcareercenteram website follow post announcement link
java developer,abg title java developer duration longterm position probationary period location yerevan armenia job description creating developing software products network job responsibilities excellent knowledge object oriented programming design excellent knowledge java jsp servlet swing jdbc rmi 4 years programming experience good knowledge html javascript php xml relational databases oracle sql mysql experience preferable required qualifications relevant university degree yerevan state university state engineering university armenia good skills english armenian languages good knowledge computers excellent communication skills team worker previous experience necessary application procedures please send cv resume email address lustianna please indicate subject java programmer position candidates asked pass interview please clearly mention application letter learned job opportunity career center mention url website wwwcareercenteram thanks application deadline 07 october 2004 place free posting job careerrelated opportunities available organization go wwwcareercenteram website follow post announcement link
web developer,xalt llc title web developer location yerevan armenia job description xalt llc seeking motivated experienced web developer develop new support existing websites created company evaluate solutions create detailed system requirement specifications well system design functional specifications job responsibilities scripting web programming html coding designing website functionality writing high quality code based implementation specification effective programming unixlinux environment participating web applications design development updating existing websites required qualifications strong knowledge php mysql html javascript xmlxsl knowledge data structures algorithms database concepts plus perl programming language knowledge desirable minimum 2 years experience relevant field good knowledge english team oriented organized initiative willing learn new skills positive attitude application procedures interested web developers position please email cover letter cv portfolio toinfo please clearly mention application letter learned job opportunity career center mention url website wwwcareercenteram thanks application deadline 18 september 2004 company xalt llc widely known xternet one leading isps armenia providing wide spectrum services including dialup fast dsl internet access webhosting domain registration consultancy place free posting job careerrelated opportunities available organization go wwwcareercenteram website follow post announcement link
