title,job_description
software developer,ameriabank cjsc title software developer term full time start date time asap duration 1 year employment contract possible extension location yerevan armenia job description incumbent responsible design installation development software applications job responsibilities design develop new software solutions improve streamline banks processes handle current issues design develop new software solutions run new processes applications initiated banks departments present status performance reports line management required qualifications university degree engineering least 1 year relevant work experience proficiency ms sql server c net framework c aspnet ajax html javascript linq adonet wcf services etc ability work pressure attention details ability make quick independent decisions ability work team courteous manners commitment work sense responsibility time management skills remuneration salary ranging 100000 2000000 amd according grade bank remuneration scheme application procedures interested qualified candidates welcome complete application form attached attach cv optional email hrit please indicate position title subject field message please clearly mention application letter learned job opportunity career center mention url website wwwcareercenteram thanks opening date 25 july 2011 application deadline 12 august 2011 company ameriabank cjsc investment bank whose strategic partner troika dialog group investmentbanking company russia august 2007 97 banks shares obtained tda holdings limited investment company affiliated troika dialog tda holdings limited holds 99 shares ameriabank cjsc additional notes shortlisted candidates interviewed attachments following attachments announcement downloaded fromhttpwwwcareercenteramccdspannphpid13571 1 application form ameriabankapplication formzip 71k place free posting job careerrelated opportunities available organization go wwwcareercenteram website follow post announcement link
project manager,sas group llc title project manager location yerevan armenia job description sas group seeking project manager responsible overall direction coordination implementation execution control completion specific projects ensuring consistency company strategy commitments goals job responsibilities lead planning implementation projects facilitate definition project scope goals deliverables define project tasks resource requirements develop full scale project plans assemble coordinate project staff manage project budget manage project resource allocation plan schedule project timelines track project deliverables using appropriate tools provide direction support project team responsible quality assurance constantly monitor report progress project stakeholders present reports defining project progress problems solutions implement manage project changes interventions archive project outputs responsible project evaluations assessment results required qualifications higher engineering education excellent knowledge english russian languages excellent computer skills qualification project management preferable knowledge project management techniques tools direct work experience project management capacity proven experience people management proven experience strategic planning proven experience risk management proven experience change management application procedures interested candidates encouraged submit cv syuzannaengibaryan mentioning project manager subject line please clearly mention application letter learned job opportunity career center mention url website wwwcareercenteram thanks opening date 11 august 2011 application deadline 30 august 2011 place free posting job careerrelated opportunities available organization go wwwcareercenteram website follow post announcement link
java developer,iunetworks llc title java developer term full time open eligibility criteria qualified candidates start date time asap duration permanent location yerevan armenia job description iunetworks looking motivated java developer web based enterprise level applications development job responsibilities analyze given task provide expertise interested parties develop software based requirements develop unit tests developed software provide task estimates interested parties identify possible risks report accurately resolve test resolution assigned requests report statuses provide technical documentation developed software required qualifications bachelors masters degree least 2 years work experience java web development experience web development java ee platform knowledge java oop knowledge java technologies jsf ejb hibernate spring jaxws axis knowledge databases good knowledge sql familiarity mysql oracle databases database modeling skills knowledge xhtml css javascript xml knowledge gwt plus ability work project development team problem solving skills strong interpersonal skills including effective writing verbal communication skills remuneration salary depending experience application procedures qualified interested candidates submit cvs job please clearly mention subject line position applying shortlisted candidates corresponding qualification invited interviews please clearly mention application letter learned job opportunity career center mention url website wwwcareercenteram thanks opening date 30 august 3011 application deadline 13 september 2011 company iunetworks llc information technology company provides integrated solutions hardware supply software development place free posting job careerrelated opportunities available organization go wwwcareercenteram website follow post announcement link
web developer,osce office yerevan title web developer start date time 19 september 2011 duration 3 months possible three months extension location yerevan armenia job description human rights unit osce office yerevan aims support public council adjunct ra ministry defense increasing awareness activities ensuring public outreach greater transparency information available public councils website also contribute strengthened cooperation civil society organizations media ra national assembly thus osce office yerevan invites applications highly qualified energetic experienced armenian professionals post web developer incumbent responsible maintaining developing website public council job responsibilities maintain intranet extranetbased applications using experience variety network technologies research track understand new web technologies maintain service applications intranet external internetrelated systems build applications using internet windows development tools provide written design documents test plans test results manage develop integrate implement web related applications components play direct role programming maintenance technical support documentation administration web applications establish communicate standards ensure continuity web applications work outside vendors developing tests ensure feature functionality make translations edit relevant materials provided council posted website uploading materials create links relevant websites perform related duties assigned required qualifications university degree computer science relevant field 35 years relevant professional experience programming knowledge php javascript experience perl sql html webbased user interface development understanding complex database concepts ability create well designed reusable objects understanding browser specific compatibility issues excellent communication skills ability work team fluency armenian excellent knowledge russian english languages previous translation andor editing experience would advantage application procedures wish apply position please use osces offline application link found underhttpwwwosceorgemployment21 offline applications along cover letters submitted directly osce office yerevan following address 641 sundukyan st yerevan 0012 republic armenia email quoting vacancy post title web developer recruitpersonnelam please clearly mention application letter learned job opportunity career center mention url website wwwcareercenteram thanks opening date 01 september 2011 application deadline 12 september 2011 1800 additional notes osce equal opportunity organization encourages female candidates apply osce office yerevan use transparent competitive screening process contact applicants interest place free posting job careerrelated opportunities available organization go wwwcareercenteram website follow post announcement link
software developer,converse bank cjsc title software developer location yerevan armenia job description na job responsibilities develop implement new information technologies software responsible effective solution problems bank study possibilities using new software responsible development automation new software case necessity develop implement appropriate software tools modules within frames operating system used bank comes interest different structural units orders well banks implement changes improvements existing software modules necessary responsible development automation software systems bankclient internetbank remote control customer service develop various information processing systems like lanhello touchscreen sms banking systems order provide necessary information customers required qualifications higher education information technology field understanding programming process good technical knowledge c c ms visual basic php programming language knowledge work experience ms sql tsql paradox mysql database knowledge work experience least 2 years experience programmer high sense responsibility analytical thinking ability work team good knowledge technical english application procedures interested candidates meet requirements position kindly requested fill application form attached send job subject field message filled follows software developer namesurname properly filled applications considered short listed candidates contacted please clearly mention application letter learned job opportunity career center mention url website wwwcareercenteram thanks opening date 13 september 2011 application deadline 12 october 2011 attachments following attachments announcement downloaded fromhttpwwwcareercenteramccdspannphpid13838 1 application form armenian application formarmzip 27k 2 application form english application formengzip 125k 3 application form russian application formruszip 126k place free posting job careerrelated opportunities available organization go wwwcareercenteram website follow post announcement link
project manager,bav city llc title project manager open eligibility criteria qualified candidates location yerevan armenia job description role project manager plan execute finalize projects according strict deadlines within budget includes acquiring resources coordinating efforts team members thirdparty contractors consultants order deliver projects according plan project manager also define projects objectives oversee quality control throughout project job responsibilities direct manage project development beginning end define project scope goals deliverables support business goals collaboration senior management stakeholders effectively communicate project expectations team members stakeholders timely clear fashion liaise project stakeholders ongoing basis estimate resources participants needed achieve project goals negotiate acquisition property required determine assess needs additional staff consultants make appropriate recruitments necessary project cycle delegate tasks responsibilities appropriate personnel identify resolve issues conflicts within project team identify manage project dependencies critical path plan schedule project timelines milestones using appropriate tools track project milestones deliverables develop deliver necessary progress reports proposals requirements documentation presentations determine frequency content status reports project team analyze results troubleshoot problem areas proactively manage changes project scope identify potential crises devise contingency plans coach mentor motivate supervise projects team members contractors influence take positive action accountability assigned work build develop grow business relationships vital success project including opening new branches able work overtime may required meeting project deadlines able participate training sessions presentations meetings required qualifications university degree pmp certification plus direct work experience project management capacity including aspects process development execution strong familiarity project management software plus demonstrated experience personnel management ability conform shifting priorities demands timelines analytical problemsolving capabilities ability react project adjustments alterations promptly efficiently flexible times change ability manage team members contractors persuasive encouraging motivating personality strong written oral communication skills english armenian strong interpersonal communication skills remuneration salary based previous experience application procedures apply please send resume totatevikzargaryan mentioning position title subject email please clearly mention application letter learned job opportunity career center mention url website wwwcareercenteram thanks opening date 14 september 2011 application deadline 23 september 2011 company bav city llc restaurant chain place free posting job careerrelated opportunities available organization go wwwcareercenteram website follow post announcement link
database administrator,vivacellmts ktelecom cjsc title database administrator term full time intended audience interested candidates start date time 01 november 2011 duration one year renewable three months probation period location yerevan armenia job description database administrator responsible managing maintaining database servers applications database administrator also responsible performance integrity security database job responsibilities design develop databases tables triggers stored procedures backup restore disaster recovery plans monitor troubleshoot fix data issues track bugs support applications analyze data provide operational metrics ensure test online database backup guarantee online replication data backup platform located another location design create new databases capacity planning including analysis database partitions available memory database size database database manager configuration options responsible database production support tasks including backups upgrades check database logs daily basis periodically change database security password trace optimize application user activities check database storage increase database size normal exceptional data growth daily basis coordinate suppliers vendors installation upgrade databases ensure implementation planning database optimization ensure documentation database configuration procedures identify application problems analyze error messages troubleshoot application errors find solutions provide regular monthly reports activities done required qualifications bachelors degree professional field engineering information technology preferred comparable experience 3 years work experience database administrator preferably telecom industry emphasis database performance tuning optimizations excellent technical knowledge telecom business related database requirements full mastery oracle ms sql server databases full mastery tsql plsql languages good knowledge ip networking windows unix operating systems full mastery sql languages optimizations good knowledge armenian english russian languages ability organize manage multiple assignments within critical deadlines ability interact positive manner internal external contacts remuneration salary vivacellmts offers competitive compensation including various benefits well trainings potential career advancement application procedures apply please send cv todatabaseadministrator please note shortlisted candidates invited interviews please clearly mention application letter learned job opportunity career center mention url website wwwcareercenteram thanks opening date 30 september 2011 application deadline 17 october 2011 company vivacellmts leading mobile operator armenia place free posting job careerrelated opportunities available organization go wwwcareercenteram website follow post announcement link
project manager,sas group llc title project manager term full time location yerevan armenia job description sas group seeking project manager responsible overall direction coordination implementation execution control completion specific construction projects ensuring consistency company strategy commitments goals job responsibilities lead planning implementation projects facilitate definition project scope goals deliverables define project tasks resource requirements develop full scale project plans assemble coordinate project staff manage project budget manage project resource allocation plan schedule project timelines track project deliverables using appropriate tools provide direction support project team responsible quality assurance constantly monitor report progress project stakeholders present reports defining project progress problems solutions implement manage project changes interventions archive project outputs responsible project evaluations assessment results required qualifications higher engineering education working experience construction project implementation coordination management excellent knowledge english russian languages excellent computer skills knowledge project management techniques tools direct work experience project management capacity proven experience people management proven experience strategic planning proven experience risk management proven experience change management remuneration salary 1000000 amd application procedures interested candidates encouraged submit cv syuzannaengibaryan mentioning project manager subject line applications privacy confidentiality guaranteed please clearly mention application letter learned job opportunity career center mention url website wwwcareercenteram thanks opening date 12 october 2011 application deadline 02 november 2011 place free posting job careerrelated opportunities available organization go wwwcareercenteram website follow post announcement link
database administrator,vivacellmts ktelecom cjsc title database administrator term full time intended audience interested candidates start date time 01 december 2011 duration one year renewable three months probation period location yerevan armenia job description database administrator responsible managing maintaining database servers applications database administrator also responsible performance integrity security database job responsibilities design develop databases tables triggers stored procedures backup restore disaster recovery plans monitor troubleshoot fix data issues track bugs support applications analyze data provide operational metrics ensure test online database backup guarantee online replication data backup platform located another location design create new databases capacity planning including analysis database partitions available memory database size database database manager configuration options responsible database production support tasks including backups upgrades check database logs daily basis periodically change database security password trace optimize application user activities check database storage increase database size normal exceptional data growth daily basis coordinate suppliers vendors installation upgrade databases ensure implementation planning database optimization ensure documentation database configuration procedures identify application problems analyze error messages troubleshoot application errors find solutions provide regular monthly reports activities done required qualifications bachelors degree professional field engineering information technology preferred comparable experience 3 years work experience database administrator preferably telecom industry emphasis database performance tuning optimizations excellent technical knowledge telecom business related database requirements full mastery oracle ms sql server databases full mastery tsql plsql languages good knowledge ip networking windows unix operating systems full mastery sql languages optimizations good knowledge armenian english russian languages ability organize manage multiple assignments within critical deadlines ability interact positive manner internal external contacts remuneration salary vivacellmts offers competitive compensation including various benefits well trainings potential career advancement application procedures please send cv todatabaseadministrator please clearly mention application letter learned job opportunity career center mention url website wwwcareercenteram thanks opening date 28 october 2011 application deadline 14 november 2011 company vivacellmts leading mobile operator armenia place free posting job careerrelated opportunities available organization go wwwcareercenteram website follow post announcement link
project manager,national instruments title project manager term full time location yerevan armenia job description national instruments seeking experienced project manager role project manager plan execute finalize projects according strict deadlines within budget includes acquiring resources coordinating efforts team members thirdparty contractors consultants order deliver projects according plan project manager also oversee quality control throughout life cycle required qualifications degree engineering computer science experience technical project management understanding phases software development lifecycle knowledge project management methodologies excellent communication skills written verbal previous experience engineer software developer qa engineer strong organizational project management skills solutiondriven personality ability identify analyze problems develop solutions strong english russian language skills application procedures please send resumes toemploymentarmenia email subject please mention project manager please clearly mention application letter learned job opportunity career center mention url website wwwcareercenteram thanks opening date 31 october 2011 application deadline 30 november 2011 company national instruments ni hightech company develops computerbased products measurement automation applications headquartered austin texas information visit wwwnicom place free posting job careerrelated opportunities available organization go wwwcareercenteram website follow post announcement link
project manager,sas group llc title project manager location yerevan armenia job description sas group seeking project manager responsible overall direction coordination implementation execution control completion specific projects ensuring consistency company strategy commitments goals job responsibilities clarify define project scope goals deliverable senior management stakeholders create execute project work plan revise appropriate meet changing needs requirements effectively communicate projects expectations team members stakeholders timely clear fashion manage daytoday operational aspects project scope ensure agreed going delivered identify track manage resolve projects issues impediments monitor risks mitigation plans proactively disseminate project information stakeholders especially senior management manage relationships facilitate project meetings throughout project phases initiation closure maintain projects documentations progress reports proposals requirements documentation presentations etc required qualifications least 23 years experience pm sphere knowledge pm techniques software development methodologies analytical thinking skills ability focus details big picture effective time management effective decision making problem solving abilities strong leadership skills goal oriented enthusiastic personality ability work pressure multitask environment excellent negotiation skills excellent written verbal communication skills english russian armenian languages remuneration salary highly competitive application procedures interested candidates encouraged submit cv syuzannaengibaryan mentioning project manager subject line applications privacy confidentiality guaranteed please clearly mention application letter learned job opportunity career center mention url website wwwcareercenteram thanks opening date 31 october 2011 application deadline 29 november 2011 place free posting job careerrelated opportunities available organization go wwwcareercenteram website follow post announcement link
